{
  "schema_version": "1",
  "status": "error",
  "summary": "The request conflicts with the current object state.",
  "items": [],
  "suggested_actions": [],
  "warnings": [],
  "error": {
    "code": "invalid_request",
    "render": {
      "ERROR": "The request conflicts with the current object state.",
      "WHY": "",
      "FIX": "Refresh the object state, correct the request, and retry."
    }
  }
}

